{
  "SLA Breach At": "2026-09-27T20:31:58.920Z",
  "SLA Exposure USD": "420",
  "Recovery State": "Service Verified",
  "Account ID": "ACCT-1002",
  "Impact ID": "IMP-20260927-230D-563200",
  "Incident ID": "INC-20260927-230D",
  "Impact Ended At": "2026-09-27T20:35:43Z",
  "Verification Evidence": "[\"fresh healthy measurement after network recovery: availability_pct=100% @ 2026-09-27T20:37:52Z (ran-oss)\"]",
  "Segment": "Public Safety",
  "Impact Started At": "2026-09-27T20:31:33Z",
  "Account Name": "East Metro Public Safety Radio",
  "Public Safety": "Yes",
  "Replay Batch": "demo-202609272031",
  "Service Instance ID": "SVC-RAN-STP-C05",
  "Tenant ID": "borealis",
  "Confidence": "0.95",
  "Basis": "4 service-affecting alarm(s) on the service's own resources (NG-LINK-FAIL, CELL-OOS) | availability_pct=0% at 2026-09-27T20:35:01Z (ran-oss) | path: SVC-RAN-STP-C05 → GNB-STP-C05 → CSR-STP-C05 → AGG-STP-01 → AGG-STP-01/Hu0/0/0/0 → OTU-MSP-STP-1 → WL-MSP-STP-C21 → FIB-MSP-STP-01",
  "Subscription ID": "SUB-20908",
  "Path": "[\"SVC-RAN-STP-C05\",\"GNB-STP-C05\",\"CSR-STP-C05\",\"AGG-STP-01\",\"AGG-STP-01/Hu0/0/0/0\",\"OTU-MSP-STP-1\",\"WL-MSP-STP-C21\",\"FIB-MSP-STP-01\"]",
  "Minutes Impacted": "4",
  "Verified At": "2026-09-27T20:38:23.318Z",
  "Impact Class": "Confirmed",
  "Topology As Of": "2026-09-27T20:31:33Z",
  "SLA ID": "SLA-PS"
}