{
  "SLA Breach At": "2026-09-27T21:14:45.000Z",
  "SLA Exposure USD": "0",
  "Recovery State": "Service Verified",
  "Account ID": "ACCT-1006",
  "Impact ID": "IMP-20260927-230D-40021A",
  "Incident ID": "INC-20260927-230D",
  "Impact Ended At": "2026-09-27T20:35:43Z",
  "Verification Evidence": "[\"customer/field confirmation: Highland Grocers store manager confirmed POS + internet working (phone call) (noc.borealis 2026-09-27T20:38:22Z)\"]",
  "Segment": "Enterprise",
  "Impact Started At": "2026-09-27T20:31:33Z",
  "Account Name": "Highland Grocers",
  "Public Safety": "No",
  "Replay Batch": "demo-202609272031",
  "Service Instance ID": "SVC-DIA-10467",
  "Tenant ID": "borealis",
  "Confidence": "0.8",
  "Basis": "no working path: every dependency path to FIB-MSP-STP-01 is down; service is unmonitored — no direct evidence | path: SVC-DIA-10467 → CKT-DIA-10467 → AGG-STP-01 → AGG-STP-01/Hu0/0/0/0 → OTU-MSP-STP-1 → WL-MSP-STP-C21 → FIB-MSP-STP-01",
  "Subscription ID": "SUB-20927",
  "Path": "[\"SVC-DIA-10467\",\"CKT-DIA-10467\",\"AGG-STP-01\",\"AGG-STP-01/Hu0/0/0/0\",\"OTU-MSP-STP-1\",\"WL-MSP-STP-C21\",\"FIB-MSP-STP-01\"]",
  "Minutes Impacted": "4",
  "Verified At": "2026-09-27T20:38:23.318Z",
  "Impact Class": "Inferred",
  "Topology As Of": "2026-09-27T20:31:33Z",
  "SLA ID": "SLA-SILVER"
}